<?xml version="1.0" encoding="UTF-8"?>
<list xmlns:xsi="http://www.w3.org/2001/XMLSchema-instance" xsi:noNamespaceSchemaLocation="../../xsd/npcs.xsd">
	<npc id="33800" level="95" type="L2Monster" name="Life Plunderer">
		<!-- AUTO GENERATED NPC TODO: FIX IT -->
		<race>FAIRY</race>
		<sex>MALE</sex>
		<mpReward value="20" type="PER" ticks="10" affects="PARTY" />
		<stats str="88" int="79" dex="55" wit="78" con="82" men="78">
			<vitals hp="17244" hpRegen="1" mp="1" mpRegen="1" />
			<speed>
				<walk ground="80" />
				<run ground="1" />
			</speed>
			<attack physical="1" magical="1" critical="4" attackSpeed="253" range="40" type="SWORD" distance="80" width="120" random="10" accuracy="5" />
			<defence physical="5000" magical="5000" />
			<attribute>
				<defence fire="20" water="20" wind="20" earth="20" holy="20" dark="20" />
			</attribute>
			<abnormalResist physical="0" magical="0" />
		</stats>
		<status attackable="false" canMove="false" />
		<skillList>
			<skill id="4390" level="1" /> <!-- NPC Abnormal Immunity -->
			<skill id="4415" level="3" /> <!-- One-handed Sword -->
			<skill id="4045" level="1" /> <!-- Resist Full Magic Attack -->
			<skill id="4416" level="13" /> <!-- Fairies -->
		</skillList>
		<collision>
			<radius normal="45" />
			<height normal="78" />
		</collision>
	</npc>
	<npc id="33801" level="99" type="L2Npc" name="Turetta" title="Appearance Modification Guide">
		<!-- AUTO GENERATED NPC TODO: FIX IT -->
		<race>HUMAN</race>
		<sex>FEMALE</sex>
		<mpReward value="20" type="PER" ticks="10" affects="PARTY" />
		<stats str="88" int="79" dex="55" wit="78" con="82" men="78">
			<vitals hp="8446" hpRegen="8.5" mp="2355" mpRegen="3" />
			<speed>
				<walk ground="64" />
				<run ground="1" />
			</speed>
			<attack physical="1949.95411856464" magical="1331.56588332443" critical="4" attackSpeed="253" range="40" type="SWORD" distance="80" width="120" random="10" accuracy="5" />
			<defence physical="405.66735" magical="296.84976" />
			<attribute>
				<defence fire="20" water="20" wind="20" earth="20" holy="20" dark="20" />
			</attribute>
			<abnormalResist physical="0" magical="0" />
		</stats>
		<status attackable="false" />
		<skillList>
			<skill id="4416" level="14" /> <!-- Humans -->
			<skill id="4390" level="1" /> <!-- NPC Abnormal Immunity -->
			<skill id="4415" level="3" /> <!-- One-handed Sword -->
			<skill id="4045" level="1" /> <!-- Resist Full Magic Attack -->
		</skillList>
		<collision>
			<radius normal="13" />
			<height normal="22.5" />
		</collision>
	</npc>
	<npc id="33802" level="99" type="L2Npc" name="Memorable Raid Soul">
		<!-- AUTO GENERATED NPC TODO: FIX IT -->
		<race>UNDEAD</race>
		<sex>MALE</sex>
		<mpReward value="20" type="PER" ticks="10" affects="PARTY" />
		<stats str="88" int="79" dex="55" wit="78" con="82" men="78">
			<vitals hp="8446" hpRegen="8.5" mp="2355" mpRegen="3" />
			<speed>
				<walk ground="50" />
				<run ground="1" />
			</speed>
			<attack physical="1949.95411856464" magical="1331.56588332443" critical="4" attackSpeed="253" range="40" type="SWORD" distance="80" width="120" random="10" accuracy="5" />
			<defence physical="405.66735" magical="296.84976" />
			<attribute>
				<defence fire="20" water="20" wind="20" earth="20" holy="20" dark="20" />
			</attribute>
			<abnormalResist physical="0" magical="0" />
		</stats>
		<status attackable="false" />
		<skillList>
			<skill id="4390" level="1" /> <!-- NPC Abnormal Immunity -->
			<skill id="4416" level="1" /> <!-- Undead -->
			<skill id="4415" level="3" /> <!-- One-handed Sword -->
			<skill id="4045" level="1" /> <!-- Resist Full Magic Attack -->
		</skillList>
		<collision>
			<radius normal="8" />
			<height normal="22.5" />
		</collision>
	</npc>
	<npc id="33803" level="99" type="L2Npc" name="Razen" title="Priestess of Light">
		<!-- AUTO GENERATED NPC TODO: FIX IT -->
		<race>HUMAN</race>
		<sex>FEMALE</sex>
		<mpReward value="20" type="PER" ticks="10" affects="PARTY" />
		<stats str="88" int="79" dex="55" wit="78" con="82" men="78">
			<vitals hp="8446" hpRegen="8.5" mp="2355" mpRegen="3" />
			<speed>
				<walk ground="50" />
				<run ground="1" />
			</speed>
			<attack physical="1949.95411856464" magical="1331.56588332443" critical="4" attackSpeed="253" range="40" type="SWORD" distance="80" width="120" random="10" accuracy="5" />
			<defence physical="405.66735" magical="296.84976" />
			<attribute>
				<defence fire="20" water="20" wind="20" earth="20" holy="20" dark="20" />
			</attribute>
			<abnormalResist physical="0" magical="0" />
		</stats>
		<status attackable="false" />
		<skillList>
			<skill id="4416" level="14" /> <!-- Humans -->
			<skill id="4390" level="1" /> <!-- NPC Abnormal Immunity -->
			<skill id="4415" level="3" /> <!-- One-handed Sword -->
			<skill id="4045" level="1" /> <!-- Resist Full Magic Attack -->
		</skillList>
		<collision>
			<radius normal="8" />
			<height normal="22.5" />
		</collision>
	</npc>
	<npc id="33804" level="99" type="L2Npc" name="Charlotte" title="Tobald's Disciple">
		<!-- AUTO GENERATED NPC TODO: FIX IT -->
		<race>HUMAN</race>
		<sex>FEMALE</sex>
		<mpReward value="20" type="PER" ticks="10" affects="PARTY" />
		<stats str="88" int="79" dex="55" wit="78" con="82" men="78">
			<vitals hp="8446" hpRegen="8.5" mp="2355" mpRegen="3" />
			<speed>
				<walk ground="50" />
				<run ground="1" />
			</speed>
			<attack physical="1949.95411856464" magical="1331.56588332443" critical="4" attackSpeed="253" range="40" type="SWORD" distance="80" width="120" random="10" accuracy="5" />
			<defence physical="405.66735" magical="296.84976" />
			<attribute>
				<defence fire="20" water="20" wind="20" earth="20" holy="20" dark="20" />
			</attribute>
			<abnormalResist physical="0" magical="0" />
		</stats>
		<status attackable="false" />
		<skillList>
			<skill id="4416" level="14" /> <!-- Humans -->
			<skill id="4390" level="1" /> <!-- NPC Abnormal Immunity -->
			<skill id="4415" level="3" /> <!-- One-handed Sword -->
			<skill id="4045" level="1" /> <!-- Resist Full Magic Attack -->
		</skillList>
		<collision>
			<radius normal="12" />
			<height normal="17" />
		</collision>
	</npc>
	<npc id="33805" level="99" type="L2Npc" name="Tiffany" title="Dazzling">
		<!-- AUTO GENERATED NPC TODO: FIX IT -->
		<parameters>
			<param name="MoveAroundSocial" value="0" />
			<param name="MoveAroundSocial1" value="100" />
		</parameters>
		<race>ELF</race>
		<sex>FEMALE</sex>
		<equipment rhand="192" lhand="192" /> <!-- Crystal Staff / Crystal Staff -->
		<mpReward value="20" type="PER" ticks="10" affects="PARTY" />
		<stats str="88" int="79" dex="55" wit="78" con="82" men="78">
			<vitals hp="1" hpRegen="1" mp="1" mpRegen="1" />
			<speed>
				<walk ground="50" />
				<run ground="100" />
			</speed>
			<attack physical="1" magical="1" critical="4" attackSpeed="253" range="40" type="SWORD" distance="80" width="120" random="10" accuracy="5" />
			<defence physical="1" magical="1" />
			<attribute>
				<defence fire="20" water="20" wind="20" earth="20" holy="20" dark="20" />
			</attribute>
			<abnormalResist physical="0" magical="0" />
		</stats>
		<status attackable="false" />
		<skillList>
			<skill id="4390" level="1" /> <!-- NPC Abnormal Immunity -->
			<skill id="4415" level="3" /> <!-- One-handed Sword -->
			<skill id="4045" level="1" /> <!-- Resist Full Magic Attack -->
			<skill id="4416" level="15" /> <!-- Elves -->
		</skillList>
		<collision>
			<radius normal="7" />
			<height normal="21.2" />
		</collision>
	</npc>
	<npc id="33806" level="1" type="L2Npc" name="Dimensional Door">
		<!-- AUTO GENERATED NPC TODO: FIX IT -->
		<race>CONSTRUCT</race>
		<sex>ETC</sex>
		<mpReward value="20" type="PER" ticks="10" affects="PARTY" />
		<stats str="88" int="79" dex="55" wit="78" con="82" men="78">
			<vitals hp="39" hpRegen="2" mp="40" mpRegen="0.9" />
			<speed>
				<walk ground="60" />
				<run ground="60" />
			</speed>
			<attack physical="8.47458" magical="5.78704" critical="4" attackSpeed="253" range="40" type="FIST" distance="80" width="120" random="5" accuracy="5" />
			<defence physical="44.44444" magical="32.52252" />
			<attribute>
				<defence fire="20" water="20" wind="20" earth="20" holy="20" dark="20" />
			</attribute>
			<abnormalResist physical="0" magical="0" />
		</stats>
		<status attackable="false" />
		<skillList>
			<skill id="4416" level="2" /> <!-- Magic Creatures -->
			<skill id="4390" level="1" /> <!-- NPC Abnormal Immunity -->
			<skill id="4415" level="1" /> <!-- Bare Hands -->
			<skill id="4045" level="1" /> <!-- Resist Full Magic Attack -->
		</skillList>
		<collision>
			<radius normal="22" />
			<height normal="45" />
		</collision>
	</npc>
	<npc id="33807" level="99" type="L2Npc" name="Verdof" title="Gatekeeper of Dimensional Hell">
		<!-- AUTO GENERATED NPC TODO: FIX IT -->
		<race>DEMONIC</race>
		<sex>MALE</sex>
		<mpReward value="20" type="PER" ticks="10" affects="PARTY" />
		<stats str="88" int="79" dex="55" wit="78" con="82" men="78">
			<vitals hp="8446" hpRegen="8.5" mp="2355" mpRegen="3" />
			<speed>
				<walk ground="70" />
				<run ground="120" />
			</speed>
			<attack physical="1949.95411856464" magical="1331.56588332443" critical="4" attackSpeed="253" range="40" type="FIST" distance="80" width="120" random="5" accuracy="5" />
			<defence physical="405.66735" magical="296.84976" />
			<attribute>
				<defence fire="20" water="20" wind="20" earth="20" holy="20" dark="20" />
			</attribute>
			<abnormalResist physical="0" magical="0" />
		</stats>
		<status attackable="false" />
		<skillList>
			<skill id="4416" level="9" /> <!-- Demons -->
			<skill id="4415" level="1" /> <!-- Bare Hands -->
			<skill id="4045" level="1" /> <!-- Resist Full Magic Attack -->
		</skillList>
		<collision>
			<radius normal="17" />
			<height normal="55" />
		</collision>
	</npc>
	<npc id="33808" level="1" type="L2Npc" name="Destiny Treasure Chest">
		<!-- AUTO GENERATED NPC TODO: FIX IT -->